{
  "active_route_ids": [
    "ER-101"
  ],
  "collision_ids": [
    "CA-001"
  ],
  "contested_scoped_claims": [
    {
      "claim_id": "CLM-001",
      "collision_ids": [
        "CA-001"
      ],
      "proposition_evidence_ids": [
        "PE-aaaaaaaaaaaa",
        "PE-bbbbbbbbbbbb"
      ],
      "scope": {
        "certainty_or_statistical_status": "reported point estimate",
        "comparator": "method B",
        "context_or_environment": "controlled benchmark",
        "direction": "higher",
        "intervention_or_exposure": "method A",
        "measurement_modality": "held-out accuracy",
        "outcome": "retrieval accuracy",
        "population_or_system": "benchmark systems",
        "time_scale": "single evaluation period"
      },
      "status": "CONTESTED",
      "text": "Method A improves retrieval accuracy relative to method B.",
      "uncertainty": "Direct contradiction requires another evidence context."
    }
  ],
  "created_at": "2026-09-05T09:04:53.249855Z",
  "new_evidence_obligations": [
    {
      "authorization_status": "AUTHORIZED",
      "obligation_id": "EO-001",
      "required_evidence_type": "Independent comparative result evidence",
      "scientific_question": "Does the conflict persist in an independent evaluation context?",
      "trigger_collision_ids": [
        "CA-001"
      ],
      "trigger_research_state_id": "RS-002",
      "why_current_evidence_is_insufficient": "Two grounded results disagree in one benchmark family."
    }
  ],
  "parent_research_state_id": "RS-001",
  "proposition_evidence_ids": [
    "PE-aaaaaaaaaaaa",
    "PE-bbbbbbbbbbbb"
  ],
  "provenance": {
    "append_only": true,
    "parent_research_state_id": "RS-001",
    "stage": "collision_update"
  },
  "redigestion_reasons": [
    "Resolve CA-001 with an independent evidence context."
  ],
  "redigestion_required": true,
  "requirements": [
    "REQ-001"
  ],
  "research_state_id": "RS-002",
  "route_status": [
    {
      "rationale": "Initial route executed.",
      "route_id": "ER-101",
      "status": "ACTIVE",
      "triggering_collision_ids": []
    },
    {
      "rationale": "Collision requires bounded re-digestion.",
      "route_id": "ER-101",
      "status": "REVISION_CANDIDATE",
      "triggering_collision_ids": [
        "CA-001"
      ]
    }
  ],
  "schema_version": "3.0-post-p1p5-b",
  "supported_scoped_claims": [],
  "unresolved_obligations": [
    {
      "authorization_status": "AUTHORIZED",
      "obligation_id": "EO-001",
      "required_evidence_type": "Independent comparative result evidence",
      "scientific_question": "Does the conflict persist in an independent evaluation context?",
      "trigger_collision_ids": [
        "CA-001"
      ],
      "trigger_research_state_id": "RS-002",
      "why_current_evidence_is_insufficient": "Two grounded results disagree in one benchmark family."
    }
  ]
}
