{
  "active_route_ids": [
    "ER-101"
  ],
  "collision_ids": [],
  "contested_scoped_claims": [],
  "created_at": "2026-09-05T09:04:53.249554Z",
  "new_evidence_obligations": [],
  "parent_research_state_id": null,
  "proposition_evidence_ids": [
    "PE-aaaaaaaaaaaa"
  ],
  "provenance": {
    "append_only": true,
    "stage": "initial"
  },
  "redigestion_reasons": [],
  "redigestion_required": false,
  "requirements": [
    "REQ-001"
  ],
  "research_state_id": "RS-001",
  "route_status": [
    {
      "rationale": "Initial route executed.",
      "route_id": "ER-101",
      "status": "ACTIVE",
      "triggering_collision_ids": []
    }
  ],
  "schema_version": "3.0-post-p1p5-b",
  "supported_scoped_claims": [],
  "unresolved_obligations": []
}
