{
  "active_route_ids": [
    "ER-901"
  ],
  "collision_ids": [],
  "contested_scoped_claims": [],
  "created_at": "2026-09-05T22:05:47.968878Z",
  "new_evidence_obligations": [],
  "parent_research_state_id": null,
  "proposition_evidence_ids": [
    "PE-568fca089922"
  ],
  "provenance": {
    "consumer_binding_id": "CQCB-5ffb908cb3d22c03",
    "stage": "package_c_positive_vertical_slice"
  },
  "redigestion_reasons": [],
  "redigestion_required": false,
  "requirements": [
    "MR-CQC-5ae322d48d72"
  ],
  "research_state_id": "RS-901",
  "route_status": [
    {
      "rationale": "The admitted route produced span-grounded proposition evidence.",
      "route_id": "ER-901",
      "status": "COVERED",
      "triggering_collision_ids": []
    }
  ],
  "schema_version": "3.0-post-p1p5-b",
  "supported_scoped_claims": [],
  "unresolved_obligations": []
}
